<?xml version="1.0" encoding="UTF-8"?>
<interesovanje xmlns="www.ftn.uns.ac.rs/interesovanje"
 xmlns:xsi="http://www.w3.org/2001/XMLSchema-instance"
 xsi:schemaLocation="www.ftn.uns.ac.rs/interesovanje interesovanje.xsd">
    <Podaci_o_primaocu>
        <Drzavljanstvo>Drzavljanin Republike Srbije </Drzavljanstvo>
        <JMBG>2910999730020</JMBG>
        <Ime>Petar</Ime>
        <Prezime>Markovic</Prezime>
        <Kontakt>
            <Adresa_elektronske_poste>petarns99@gmail.com</Adresa_elektronske_poste>
            <Broj_mobilnog_telefona>0692910099</Broj_mobilnog_telefona>
            <Broj_fiksnog_telefona>021493103</Broj_fiksnog_telefona>
        </Kontakt>
        <Davalac_krvi>Da</Davalac_krvi>
    </Podaci_o_primaocu>
    <Odabir_vakcine>Pfizer-BioNTech </Odabir_vakcine>
    <Datum>2021-05-04</Datum>
</interesovanje>
